Unnamed: 0,번호,제목,저자,출판사,출판일
,60,A Study on the Consumer Perception and Keyword Analysis of Meal-kit Using Big Data,정선미,한국인터넷방송통신학회,2022
,61,Constructing Efficient Regional Hazardous Weather Prediction Models through Big Data Analysis,"Lee, Jaedong",Korean Institute of Intelligent Systems,2016
,62,분자육종 연구에서 Big Data를 활용한 가이드 RNA(gRNA) 제작의 중요성,정찬영(Chan Young Jeong),한국통신학회,2020
,63,Conceptual Approach for the New Cognition of Hotel Industry in the Era of Big Data: A Systematic Review,Shuting Tao,한국조리학회,2020
,64,Development of an Optimized Accident Prediction Model for Construction Safety Using Big Data Analysis,허준규,인간식물환경학회,2024
,65,A Map Reduce based Support Vector Machine for Big Data Classification,Anushree Priyadarshini,보안공학연구지원센터,2015
,66,LSTM-based Anomaly Detection on Big Data for Smart Factory Monitoring,Van Quan Nguyen,한국디지털콘텐츠학회,2018
,67,Development and Evaluation of an Obesity Ontology for Social Big Data Analysis,"Kim, Ae Ran",Korean Society of Medical Informatics,2017
,68,A Study on the Development of Service Quality Scale in Traditional Market for Big Data Analysis,"HWANG, Moon-Young",한국인공지능학회,2019
,69,The advantages and challenges of “big data”: Insights from the 14 billion word iWeb corpus,Mark Davies,경희대학교 언어정보연구소,2019
,70,Smart Space based on Platform using Big Data for Efficient Decision-making,이진경,한국정보화진흥원,2018
,71,Research on Chinese Audience Perception with K-pop Girl Group Music Videos Based on Big Data: The Blackpink as an Example,징 치웨이,인문사회 21,2023
,72,Research and Technology Trend Analysis by Big Data-Based Smart Livestock Technology: a Review,김민지,한국농업기계학회,2021
,73,How to improve oil consumption forecast using google trends from online big data?: the structured regularization methods for large vector autoregressive model,"Choi, Ji-Eun",The Korean Statistical Society,2022
,74,THE EFFECT OF RESTAURANT PLATFORM ENDORSEMENTS ON CUSTOMERS’ ATTITUDES: A BIG DATA-BASED QUASI-EXPERIMENTAL APPROACH,Dohyung Bang,글로벌지식마케팅경영학회,2023
,75,Development of an Atopic Dermatitis Incidence Rate Prediction Model for South Korea Using Air Pollutants Big Data: Comparisons Between Regression and Artificial Neural Network,Lim Byeonggeuk,한국화학공학회,2025
,76,Epidemiology of ALS in Korea using nationwide big data,"Jun, Kyo Yeon",British Medical Association,2019
,77,Effects of Experiences in AI and Big Data-based Fashion Shopping Apps on the Consumer’s Emotional Response and Continuance Intention,"Kim, Sun Ah(김선아)",한국디자인문화학회,2021
,78,A Study on Methodologies of Drug Repositioning Using Biomedical Big Data: A Focus on Diabetes Mellitus,이수현,대한내분비학회,2022
,79,A Study on the Perception of Metaverse Fashion Using Big Data Analysis,임호선,한국의류산업학회,2023
,80,Housing Market Trend Forecasts through Statistical Comparisons based on Big Data Analytic Methods,"Han, Seungwoo",American Society of Civil Engineers,2018
,81,A Research on Difference Between Consumer Perception of Slow Fashion and Consumption Behavior of Fast Fashion: Application of Topic Modelling with Big Data,Oh-Suk YANG,국제융합경영학회,2021
,82,IT Jobs in the Era of Digital Transformation: Big Data Analytics,이호,한국경영정보학회,2019
,83,Research on Major Trends of Smart Technologies in the Construction Sector Analyzed Through Big Data: Focusing on Government-initiative Projects,홍원표,국제문화기술진흥원,2024
,84,Cross&#x2010;Cultural Comparison of Nonverbal Cues in Emoticons on Twitter: Evidence from Big Data Analysis,"Park, Jaram","Wiley Subscription Services, Inc.",2014
,85,Laparoscopic surgery versus open surgery for gastric cancer: big data analysis based on nationwide administrative claims data,Hyojung Hwang,대한외과학회,2020
,86,Performance Evaluation of Hadoop and Oracle Platform for Distributed Parallel Processing in Big Data Environments,A. K. M. Mahbubul Hossen,보안공학연구지원센터,2015
,87,Exploring the Competitive Advantage of Coffee Shops’ Locations using Spatial Big Data Based on i2SFCA and Contour Tree Technique: The Case of Incheon Metropolitan City,김현중,한국인문사회질학회,2022
,88,A Study on Prediction of Traffic Volume Using Road Management Big Data,성홍기,한국측량학회,2015
,89,IT Jobs in the Era of Digital Transformation : Big Data Analytics,Ho Lee,한국경영정보학회,2019
,90,Minor alleles in the FTO SNPs contributed to the increased risk of obesity among Korean adults: meta-analysis from nationwide big data-based studies,김오연,한국영양학회,2023
,91,Changing Disease Trends in the Northern Gyeonggi-do Province of South Korea from 2002 to 2013: A Big Data Study Using National Health Information Database Cohort,Young Soo Kim,질병관리본부,2018
,92,Big Data기반 도시하천 친수 공간정보 활용기술 개발,"김창성(Kim, Chang Sung)",대한토목학회,2021
,93,Big Data를 활용한 미래도로 구상,조한선,한국도로학회,2017
,94,Big Data의 활용,이진천,대한설비공학회,2013
,95,Big data분석기법의 국방과학기술 적용방안 연구,손창호,한국시뮬레이션학회,2017
,96,Big data와 기계학습을 활용한 PM<SUB>2.5</SUB> 예보,구윤서,한국대기환경학회,2022
,97,Big Data를 활용한 보호계전기 입력요소 적정성 판단에 대한 연구,김종호(Jong-Ho Kim),대한전기학회,2022
,98,Big data를 활용한 국방 M&S의 경험 Database 구축 방안,김성규,한국경영과학회,2015
,99,Big data를 활용한 국방 M&S의 경험 Database 구축 방안,김성규,대한산업공학회,2015
,100,Big Data를 활용한 IT융합기술 모델과 사례연구,황두영,제어로봇시스템학회,2013
,1,Big Data의 이해 - 가치와 도입전략,이성희(Seong-Hui Lee),한국컴퓨터정보학회,2012
,2,Data-Driven Healthcare & Analytics in a Big Data World,장혜정,대한의료정보학회,2015
,3,Social big data: Recent achievements and new challenges,"Bello-Orgaz, G.","Elsevier Science B.V., Amsterdam.",2016
,4,공공 ‘Big-Enough Data’ 분석 사례 및 과제,이택면,한국사회학회,2014
,5,수처리시설 Big Data를 이용한 Smart O&M 적용 기법 개발,이건희,대한환경공학회,2019
,6,Integrating “Big Data” into Surgical Practice,Jaesoon Choi,대한외과학회,2018
,7,부동산 경매 Big Data를 활용한 Chaos 분석,강준,한국경영정보학회,2017
,8,Development of Big Data-based Cardiovascular Disease Prediction Analysis Algorithm,Kyung-A KIM,한국인공지능학회,2023
,9,[Special Ⅱ_ESG] <Big Data> 500대 기업 ESG 등급과 주가상승률,박지훈,(주)매일경제신문사,2021
,10,4차 산업혁명시대 여가생활을 위한 AI와 Big Data의 활용,박범기,한국융합경영학회,2019
,11,Towards Social Big Data-Based Affective Group Recommendation,"Hong, Minsung",Springer-Verlag,2018
,12,Critical Care Research Using “Big Data”: A Reality in the Near Future,Kwangha Lee,대한중환자의학회,2018
,13,공기청정기용 적용 센서 및 Big Data활용,박찬정,한국건축친환경설비학회,2018
,14,Factory Intelligence를 위한 Big Data활용 사례 분석,2016 KSIE하계특별세미나,한국산업경영시스템학회,2016
,15,"정보화 에세이 : Big Data와 지역정보화, 상생효과 높이기",학계자료,한국지역정보개발원(구 자치정보화조합),2012
,16,"Cherry Tomato Cultivation, Environmental Big Data Collection, Data-base Farmhouse Consulting",Jung-Mi Park,한국원예학회,2023
,17,Application of genomic big data to analyze the genetic diversity and population structure of Korean domestic chickens,Eunjin Cho,한국축산학회,2023
,18,“Cloud Computing & Big Data” 특집호를 발간하며...,한성수,한국정보처리학회,2021
,19,The Future of Big Data:,Daumsoft,한국IT서비스학회,2018
,20,"Interaction among Networks in the age of ""Big Data"": Social, Knowledge, Innovation, and Triple-Helix Networks","Jung, Kyujin",World Association for Triple Helix and Future Strategy Studies,2014
,21,Brand Clustering Based on Social Big Data: A Case Study,"Kang, Ha-Na",Global Vision Press,2016
,22,Development of standard loss analysis model using big data: Focusing on Republic of Korea army,이승호,광운대학교 방위사업연구소,2022
,23,정보속으로: IT 이슈 : Social Big DATA의 의미와 트렌드 분석,강학주,한국지역정보개발원 (구 자치정보화조합),2012
,24,Classification of Metro Station Areas Using Multi-Source Big Data: Case Studies in Beijing,Shuo Chen,Council on Tall Building and Urban Habitat Korea,2023
,25,"Surviving in the era of ""Big Data""",권석운,대한혈액학회,2013
,26,정책갈등 지식관리 체계 구축 및 활용에 관한 연구(I): Big data를 중심으로,윤종설,한국행정연구원,2015
,27,의약품의 QT/QTc 간격연장 및 전부정맥 위험성 평가 : 한국인 심전도 Big Data분석으로 본 ICH E14 가이드라인 적용의 고려할 점,윤재석,한국에프디시규제과학회(구 한국에프디시법제학회),2015
,28,A Study on Future Prediction and Policy Cases Using Big Data: Focus on Disaster Management,"Kim, Jong Eop",한국지방정부학회,2015
,29,정책갈등 지식관리체계 구축 및 활용에 관한 연구(Ⅱ): Big Data를 중심으로,윤종설,한국행정연구원,2016
,30,Public Perceptions Toward Ethnic Return Migrants in South Korea : A Big Data-Based Language Analysis,이문우,한국사회언어학회,2022
,31,The study on Analysis of factors of restaurant start-ups using big data,이진호,한국인터넷방송통신학회,2023
,32,The Possibilities as a Prediction Tool for Cancer Research of Big Data: Comparison of Incidence Rate of Korean Major Male and Urologic Cancers and Trend Scores,강동혁,대한비뇨기종양학회,2015
,33,Multiple Antiplatelet Therapy in Ischemic Stroke Already on Antiplatelet Agents Based on the Linked Big Data for Stroke,Kim Tae Jung,대한의학회,2023
,34,Legal Concerns of Financial Institutions in the Big Data Era - The Use of De - Identified Personal Information without Prior Consent under the Korean Privacy Laws -,조혜찬,한국정보법학회,2016
,35,Challenges and Opportunities for Occupational Therapy in Big Data Research,Ickpyo Hong,대한작업치료학회,2019
,36,Standardization Requirements Analysis on Big Data in Public Sector based on Potential Business Models,"Suwook Ha,Seungyun Lee,Kangchan Lee",보안공학연구지원센터,2014
,37,Legal Concerns of Financial Institutions in the Big Data Era,"Cho, Hyechan(조혜찬)",한국정보법학회,2016
,38,The Study on the Business Development Prospects Analysis Using Big Data,Hwan-Seok Yang,보안공학연구지원센터,2016
,39,Is Big Data a Big Dilemma or a Big Opportunity in China? Intellectual Property Protection in the Era of Big Data,Xiao Ma,이준국제법연구원,2018
,40,Applications Analysis of Big Data Analysis in the Medical Industry,Zhendong Ji,보안공학연구지원센터,2015
,41,The Usage Needs and Adoption Intention of Manufacturing Big Data Technology in Small and Medium-sized Manufacturing Companies,김지대,한국기업경영학회,2016
,42,A Study on Big Data Analytics Services and Standardization for Smart Manufacturing Innovation,김철림,한국인터넷방송통신학회,2022
,43,The Mediating Effect of Delivery Big Data Service Expectations on the Relationship between Perceived Mobile Usability and Smart Delivery Use Intention,천홍말,한국유통경영학회,2013
,44,Big Data and the Prospects of Historical Research - A study of research in modern and contemporary Korean history - = 빅데이터와 역사학 연구의 전망,Minki Moon(문민기),고려대학교 한국사연구소,2019
,45,Personal Information Protection Crisis Management in Big Data,Kwan Sig Choi,위기관리 이론과 실천,2021
,46,The Concept of Pattern based Data Sharing in Big Data Environments,Muhammad Habib ur Rehman,보안공학연구지원센터,2015
,47,CASE STUDY ON BIG DATA MARKETING IN A KOREAN MULTICHANNEL RETAIL COMPANY,Jaehee Chung,글로벌지식마케팅경영학회,2016
,48,Impact of Big Data Analytics on Indian E-Tailing from SCM to TCS,Avinash BM,한국유통과학회,2024
,49,Study on the Big Data Utilization for the Parliamentary Library and Research Services,Joonhwa Jung,한국의정연구회,2017
,50,BGP Design for the Separation of the Local Big Data Traffic in Data Center,Hyoung Woo Park,보안공학연구지원센터,2015
,51,Text Mining and Visualization of Unstructured Data Using Big Data Analytical Tool R,남수태,The Korea Institute of Information and Commucation Engineering,2021
,52,Big Data Service Design :Collection to Analysis in the Cloud Computing Ecosystem,D. Jaswanth,차세대컨버전스정보서비스학회,2021
,53,Research on the Application of Big Data Ecology in College Physical Education Teaching and Training,Yu Huan,한국스포츠학회,2020
,54,Big Data and Optimization of College Students' Education Management Mode,Jianwei Yang(Jianwei Yang),ACADEMIC FRONTIERS PUBLISHING GROUP(AFP),2024
,55,A Study on Game Keyword Search Volume and Global Game Performance with Big Data,"LEE, Hyunjin",한국무역금융보험학회(구 한국무역보험학회),2017
,56,Optimizing NUMA System Beyond 100 Gbps for Big Data,유세영,한국지식정보기술학회,2021
,57,Adoption of Big Data Technologies for Communication Management in Large Projects,Suhail Memon,보안공학연구지원센터,2016
,58,The Big Data Applications in Film Industry Chain,Xinran Wang,보안공학연구지원센터,2016
,59,Data Lakes for Big Data and its Role in Current ICT,Ajit Singh,한국디지털융합학회,2021
,60,Challenges and Opportunities for Occupational Therapy in Big Data Research,홍익표,대한작업치료학회,2019
,61,Big Data Analysis Framework for Healthcare and Social Sectors in Korea,송태민,대한의료정보학회,2015
,62,Big Data and Hadoop for Productive Social Commerce: Trending in Social Media Users and Entrepreneurs,Youn-Hwan Choi,보안공학연구지원센터,2016
,63,A study on the establishment of policies for the activation of a big data industry and prioritization of policies: Lessons from Korea,"Kwon, T.H.",American Elsevier,2015
,64,Profiling the Use of Analytical Platforms and Future Architecture: From Big Data Professional’s Perspectives,최무진,한국로고스경영학회,2017
,65,Big Data and the Prospects of Historical Research - A study of research in modern and contemporary Korean history -,문민기,고려대학교 한국사연구소,2019
,66,Big Data in Healthcare Hype and Hope = 의료 분야에 있어서 대용량 데이터의 활용,"Sul Gi, Kim(김슬기)",(사)한국CDE학회,2013
,67,"Big data, how to balance privacy and social values",Joo-Seong Hwang,한국디지털정책학회,2013
,68,Agriculture Big Data Analysis System Based on Korean Market Information,Tserenpurev Chuluunsaikhan,한국멀티미디어학회,2019
,69,The Impact of Artificial Intelligence and Big Data on the Evolution of Accounting Practices : Opportunities and Challenges,양쯔잉,한국디지털정책학회,2024
,70,Utilizing AI and Big Data in Education: The Current State and Future Directions,이예경,한국열린교육학회,2021
,71,A Study on Policy and System Improvement Plan of Geo-Spatial Big Data Services in Korea,박준민,한국측량학회,2016
,72,Applications of Big Data and AI-Driven Technologies in High-Dimensional Data Analysis: Taiwanese Bankruptcy Prediction Using Machine Learning Models with Factor Analysis,JUYONG KO,한국산업응용수학회,2024
,73,Change Analysis and Development Direction of BK21 PLUS Project : Focusing on Social Big Data Analysis,Sung-Jun Myung,한국자치행정학회,2017
,74,A Study on the Impact of Strategic Orientation on International Performance of Chinese Small and Medium-sized Cross-border E-Commerce Enterprises in the Post-Epidemic Period―Focusing on the Mediating Role of Big Data Capabilities with Data from Enterpri,상홍강,아시아.유럽미래학회,2022
,75,Development of Examination Model of Weather Factors on Garlic Yield Using Big Data Analysis,Shinkon Kim(김신곤),한국산학기술학회,2018
,76,Big Data in Healthcare: An Investigation into Medical Data Management and Privacy Implications in China,Bhaskar P. Sai,차세대컨버전스정보서비스학회,2022
,77,The Impact of Big Data Investment on Firm Value,Ji-Hong Min,한국유통과학회,2015
,78,UPS Applying Big Data Analytics to Logistics:,Sung-Hee “Sunny” Park,한국경영정보학회,2014
,79,Double Privacy Layer Architecture for Big Data Framework,Do-Eun Cho,보안공학연구지원센터(IJSEIA),2016
,80,Development of Electric Trading System Using Big Data,Cheol-Woong Lee,보안공학연구지원센터,2014
,81,Improvised methods for tackling big data stream mining challenges: case study of human activity recognition,"Fong, S.",Springer Science + Business Media,2016
,82,"Research on Big Data Privacy Protection based on the Three-Dimensional Integration of Technology, Law, and Management",Dekui Wang,한국정보기술학회,2021
,83,"Big Data Strategies for Government, Society and Policy-Making","LEE, Jung Wan",Korea Distribution Science Association,2020
,84,Big Data Analysis in School Adjustment Factors using Data Mining,Sujeong Ko,한국인터넷방송통신학회,2019
,85,A Study on Game Keyword Search Volume and Global Game Performance with Big Data,이현진,한국무역보험학회,2017
,86,Challenges and Opportunities of Big Data,Md Ibrahim Khalil,ICT플랫폼학회,2020
,87,A Strategy Study on Sensitive Information Filtering for Personal Information Protect in Big Data Analyze,Gun-Seo Koo(구건서),한국컴퓨터정보학회,2017
,88,"Round and Round the Garden? Big Data, Small Government and the Balance of Power in the Information Age = 부질없는 정원 돌기? 빅데이터, 작은 정부 그리고 정보시대에서의 힘의 균형",Judith Rauhofer,서울대학교 공익산업법센터,2015
,89,Big Data Performance Evaluation Analysis Using Apache Pig,Gal Engelberg,보안공학연구지원센터,2016
,90,Financial and Economic Risk Prevention and Countermeasures Based on Big Data and Internet of Things,Songyan Liu,한국정보처리학회,2024
,91,A Trend Analysis of Floral Products and Services Using Big Data of Social Networking Services,Sin Young Park,인간식물환경학회,2019
,92,Big data analysis and artificial intelligence in epilepsy – common data model analysis and machine learning-based seizure detection and forecasting,Chung Yoon Gi,대한소아청소년과학회,2022
,93,Facilitating Conditions in Adopting Big Data Analytics at Medical Aid Organizations in South Africa,"VELA, Junior Vela",Korea Distribution Science Association,2022
,94,The Evolution of Big Data Ecosystems : Co-Hashtag Network Analysis and Community Structure Detection,Bongsug (Kevin) Chae,한국경영정보학회,2015
,95,한국 고전문학 연구와 빅데이터(Big data)의 활용,"정규식(Chung, Ku-Sik)",영남대학교 인문과학연구소,2015
,96,Big Data Analysis on the Perception of Home Training According to the Implementation of COVID-19 Social Distancing,금현창,한국인터넷방송통신학회,2023
,97,Application Analysis of Smart Tourism Management Model under the Background of Big Data and IOT,Gangmin Weng,한국정보처리학회,2023
,98,A Proposal of a Defense Model for the Abnormal Data Collection using Trace Back Information in Big Data Environments,YanTing Mu,한국지식정보기술학회,2015
,99,A review of big data analytics and healthcare,문석재,한국응용과학기술학회,2020
,100,The Impact of Big Data Investment on Firm Value,민지홍,한국유통과학회,2015
,1,The Adoption of Big Data to Achieve Firm Performance of Global Logistic Companies in Thailand,"KITCHAROEN, Krisana",Korea Distribution Science Association,2023
,2,Influence of Big Data Analytics Capability on Innovation and Performance in the Hotel Industry in Malaysia,Muhamad Luqman KHALIL(Muhamad Luqman KHALIL ),한국유통과학회,2023
,3,A Trend Analysis of Floral Products and Services Using Big Data of Social Networking Services,박신영,인간식물환경학회,2019
,4,"Implementing a Sustainable Decision-Making Environment - Cases for GIS, BIM, and Big Data Utilization -",Kim Hwan Yong,한국BIM학회,2016
,5,A Study on the Development of Next Generation Intelligent Integrated Security Management Model using Big Data Technology,JeongBeom Kim,보안공학연구지원센터,2015
,6,A Study on the Policy Trends for the Revitalization of Medical Big Data Industry,Hyejin Kim,한국디지털정책학회,2020
,7,The Research and Application of a Big Data Storage Model,Na Liu,보안공학연구지원센터,2015
,8,From Multimedia Data Mining to Multimedia Big Data Mining,"Constantin, Gradinaru Bogdanel",International Journal of Computer ScienceNetwork Security,2022
,9,Exploring Big Data Utilization in Christian Education,Heeja Kim,한국기독교교육정보학회,2014
,10,Medical Big Data Is Not Yet Available - Why We Need Realism Rather Than Exaggeration,김헌성,대한내분비학회,2019
,11,Generating Traffic Safety Test Scenarios for Automated Vehicles using a Big Data Technique,서재현,대한토목학회,2019
,12,A Business Application of the Business Intelligence and the Big Data Analytics,이기광,한국산업경영시스템학회,2019
,13,Research on Execution of Civil Servants and Professional Ethics based on Data Mining Technique and Joint Modeling Analysis of Multiple Factors under Big Data Environment,Yang Du,보안공학연구지원센터,2016
,14,A Study on Big Data Platform Architecture-based Conceptual Measurement Model Using Comparative Analysis for Social Commerce,황성태,한국지식정보기술학회,2020
,15,Integration and Synergistic Development of Computer Software Technology and Big Data Systems,Ziyi Wang(Ziyi Wang),ACADEMIC FRONTIERS PUBLISHING GROUP(AFP),2024
,16,An Exploratory Study on the Efficacy of Big Data Analytics to Indian SME’s,Narasimha Rao Vajjhala,한국유통과학회,2017
,17,"Exploring the Role of Big Data in Reshaping Competitive Advantages in the Film and Television Industry = What Do We Know, What Can We Learn?",Meng Meng Wang,한국경영학회,2014
,18,Study on the Big Data Utilization for the Parliamentary Library and Research Services,정준화,한국의정연구회,2017
,19,Research on Marketing Strategy of Social Network Media Based on Big Data Analysis,Hongmei Sun,보안공학연구지원센터,2016
,20,A Study on the Perception and Context of Sportswear Brand Collaboration through Big Data Analysis,변경원,한국인터넷방송통신학회,2024
,21,Research on the Application of Big Data Technology in Cross-border Crime Governance in Lancang-Mekong Countries,Liang Xu(Liang Xu),YIXIN 출판사,2024
,22,Towards Conceptual Predictive Modeling for Big Data Framework,Jeong-Sig Kim,보안공학연구지원센터(IJSEIA),2016
,23,Anonymity Personal Information Secure Method in Big Data environment,Sunghyuck Hong,중소기업융합학회,2018
,24,Improving Disaster Management Capability and Disaster Resilience by Using Big Data - A Comparative Analysis between Korea and China -,Linpei Zhai,위기관리 이론과 실천,2022
,25,Big Data Analysis of the Women Who Score Goal Sports Entertainment  Program: Focusing on Text Mining and Semantic Network Analysis.,Hyun-Myung Kim,한국인터넷방송통신학회,2023
,26,Developing Big Data Usage Index Using AHP: Application of Major Industries,김성현,한국엔터프라이즈아키텍처학회,2017
,27,Big Data Analysis in School Adjustment Factors using Data Mining,고수정,한국인터넷방송통신학회,2019
,28,Philosophical Telescope: Should We use Big Data Statistics as Analytic Tools in Philosophy of Sport?,Jin Hyunju,한국체육학회,2019
,29,A Study on Concepts and Utilization of Geo-Spatial Big Data in South Korea,유선철,대한토목학회,2016
,30,Data Management of Connected vehicle applications using Big Data technology,Lionel Nkenyereye,한국정보통신학회,2015
,31,Big Data and Blockchain to Improve Performance of Professional Sports Teams,Yuri Hong,한국정보통신학회,2018
,32,A Study of Big Data Utilization in the South Korean Film Industry,Sangwon Ro,중앙대학교 영상콘텐츠융합연구소,2015
,33,"Challenges of Big Data in Practice: Leadership, Strategy, and Operations",최무진,한국로고스경영학회,2014
,34,The Big Data Analytics Regarding the Cadastral Resurvey News Articles,주용진,한국측량학회,2014
,35,Applications of Medical Big Data and Personal Information Protection,탕홍(Hong Tang),원광대학교 법학연구소(의생명과학법센터),2024
,36,Big Data Analysis in School Adjustment Factors using Data Mining,"Ko, Sujeong",The Institute of Internet,2019
,37,The Current Situation of the Big Data Utilization in the Agricultural Food Area and its Future Direction,Daniel Byungho Chung,한국농식품정보과학회,2013
,38,Big Data Analytics in Health Care by Data Mining and Classification Techniques,Jayasri N.P.,한국통신학회,2022
,39,Big Data Collection Study for Providing Efficient Information,Jun-soo Yun,보안공학연구지원센터,2015
,40,CUSTOMER RELATIONSHIP MANAGEMENT FOR JOINT DISEASES BASED ON BIG DATA ENVIRONMENT,Myung- Ki Nam,한국엔터테인먼트산업학회,2018
,41,Crime Pattern Analysis based on Machine Learning and Big Data using Apache Spark,Palash Sontakke,한국디지털융합학회,2018
