Unnamed: 0,번호,제목,저자,출판사,출판일
,78,Integration of Big Data Analytics (BDA) in Forensic Accounting for the listed companies in KOSPI: To provide a technical strategy aimed at embezzlement detection and prevention,김규현,대한산업공학회,2024
,79,Artificial intelligence techniques for outcome prediction in marketing strategies and big data analytics for businesses,Donggeun Kim,한국경영정보학회,2023
,80,"Smart cities with big data: Reference models, challenges, and considerations","Lim, Chiehyeon",Elsevier,2018
,81,Integration of Big Data Analytics (BDA) in Forensic Accounting for the listed companies in KOSPI: To provide a technical strategy aimed at embezzlement detection and prevention,김규현,한국경영과학회,2024
,82,A Study on Efficient Building Energy Management System Based on Big Data,Young-Hyun Chang,한국인터넷방송통신학회,2019
,83,Design and Implementation of Hadoop-based Customer Marketing Big Data Processing System,Yang Liu,보안공학연구지원센터,2016
,84,Dynamic Guaranteed Cost Compression for Time Series Big Data,Miao Bei-bei,보안공학연구지원센터,2015
,85,Feature Selection Using Submodular Approach for Financial Big Data,Girija Attigeri,한국정보처리학회,2019
,86,Design and Implementation of Incremental Learning Technology for Big Data Mining,Byung-Won Min,한국콘텐츠학회(IJOC),2019
,87,A Study on Construction of Aids to Navigation Big Data Based on S-201,김윤지,한국항해항만학회,2022
,88,Communication Management of Large Projects in Big Data Environment,Suhail Memon,보안공학연구지원센터,2015
,89,Identifying Barriers to Big Data Analytics: Design-Reality Gap Analysis in Saudi Higher Education,"AlMobark, Bandar Abdullah",International Journal of Computer ScienceNetwork Security,2021
,90,A Study on FIFA Partner Adidas of 2022 Qatar World Cup Using Big Data  Analysis,Kyung-Won Byun,한국인터넷방송통신학회,2023
,91,From Big Data to Business Value : Emerging Technology Extraction and Analysis System Based on Korean Newspapers,Dong-Suk Hong(홍동숙),한국엔터테인먼트산업학회,2014
,92,Big Data Process Method and Usage,이성훈,한국정보기술학회,2013
,93,Big Data Analysis on Consumer Perception of Pressure Injuries: Text Mining and Semantic Network Analysis,박경희,대한창상학회,2024
,94,Enhanced Regular Expression as a DGL for Generation of Synthetic Big Data,Kai Cheng,한국정보처리학회,2023
,95,DTG Big Data Analysis for Fuel Consumption Estimation,조원희,한국정보처리학회,2017
,96,A Study of Hybrid Heterogeneous System Based on Big Data Query,Sang Hailing,보안공학연구지원센터,2016
,97,Big Data 분석을 활용한 통신망 관리 시스템의 개선방안에 관한 연구,"구성환(Koo, Sung-Hwan)",한국산학기술학회,2012
,98,“DON’T JUDGE A BOOK BY ITS COVER.” HOW BIG DATA CHANGES DECISION PROCESSES OF MARKETING MANAGERS.,Christoph Wortmann,글로벌지식마케팅경영학회,2018
,99,DTG Big Data Analysis for Fuel Consumption Estimation,"Cho, Wonhee",Korea Information Processing Society,2017
,100,Finding Industries for Big Data Usage on the Basis of AHP,이상원,한국디지털정책학회,2016
,1,Big data-based piping material analysis framework in offshore structure for contract design,"Oh, Min-Jae",Techno-Press,2019
,2,k-NN Join Based on LSH in Big Data Environment,"Ji, Jiaqi",The Korea Institute of Information and Commucation Engineering,2018
,3,BIG DATA IN FAMILY BUSINESS MARKETING ACTIVITIES DECISIONS,Isabel Torres,글로벌지식마케팅경영학회,2018
,4,Construction and Application of Information Base of Urban Residential Landscape Based on Big Data,Wang Shunhui,보안공학연구지원센터,2015
,5,A Research Analysis of QR code based on big data in Korea,Eun-ji Lee(이은지),한국컴퓨터정보학회,2021
,6,"A Collaborative Inventory Management of Big Data Supply Chain based on System Dynamics: China""s Beer Industry",Jinhui Chen,한국정보통신학회,2021
,7,A Study on the Collaborative Inventory Management of Big Data Supply Chain : Case of China’s Beer Industry,Jinhui Chen(진금회),한국컴퓨터정보학회,2021
,8,A Big Data Analytics Platform for Smart Factories in Small and Medium-Sized Manufacturing Enterprises: An Empirical Case Study of a Die Casting Factory,이주연,한국정밀공학회,2017
,9,Forecast Likelihood of Stock Trading Price Based on Big Data Analysis,Soo-Tai Nam,한국정보통신학회,2019
,10,Big Data Meets Telcos: A Proactive Caching Perspective,Ejder Ba¸stu˘g,한국통신학회,2015
,11,Big Data Processing Strategies for Low-cost Monitoring of Airborne Particulate Matter in Mine Sites,Eui Young Seo,계명대학교 자연과학연구소,2021
,12,TREND ANALYSIS FOR CUSTOMER PURCHASING INTENTION BASED ON BIG DATA ENVIRONMENT,Myung- Ki Nam,한국엔터테인먼트산업학회,2018
,13,A Study on the Sentiment Analysis of City Tour Using Big Data,Se-won Jeon,한국인터넷방송통신학회,2023
,14,Integrating Normalization with Random Tree Data Mining Approach for Mining Cloud Based Big Data’s of Asthma Patient’s,Abhinav Hans,보안공학연구지원센터,2015
,15,Offline-to-Online Service and Big Data Analysis for End-to-end Freight Management System,Suganya Selvaraj,한국정보처리학회,2020
,16,Big data를 이용한 Warehouse Management System 모델 연구 - SAP S/4 Hana를 중심으로 -,이성훈,동중앙아시아경상학회,2019
,17,"Navigating ePolicy Cycle: Big Data, Citizen, and Government",이은미,(사)위기관리이론과실천,2023
,18,Airline Data Set Analysis using Big Data in Cloud Computing,Nillohit Bhattacharya,한국경영정보학회,2017
,19,Localized indoor air quality monitoring for indoor pollutants’ healthy risk assessment using sub-principal component analysis driven model and engineering big data,시홍란,한국화학공학회,2015
,20,Curating Big Data for Health and Wellness in Cloudcentric IoT,무하마드 비랄 아민,한국통신학회,2018
,21,Investigation of Personal Information Protection Schemes in the Era of Big Data,구단,한중사회과학학회,2022
,22,Strategies for the Development of Watermelon Industry Using Unstructured Big Data Analysis,"LEE, Seung-In",한국유통과학회,2021
,23,Study on group financial sharing issues in big data era,Zhou Chen,한국유통과학회,2017
,24,A Survey on SLA Management for Cloud Computing and Cloud-Hosted Big Data Analytic Applications,Radhya Sahal,보안공학연구지원센터,2016
,25,Real-time secure communication for Smart City in high-speed Big Data environment,"Rathore, M. Mazhar",Elsevier,2018
,26,Performance Comparison of MySQL Cluster and Apache Spark for Big Data Applications,Indira Bidari,보안공학연구지원센터,2016
,27,Advancing Cancer Prevention and Behavior Theory in the Era of Big Data,Audie A. Atienza,대한암예방학회,2016
,28,Multilevel Analysis on Factors Affecting Fundus Examination Using Big Data,Min-Kyoung Kim,한국정보통신학회,2019
,29,Development of big data based Skin Care Information System SCIS for skin condition diagnosis and management,Hyung-Hoon Kim(김형훈),한국컴퓨터정보학회,2022
,30,Credit Risk Analysis Using the Big Data of Chinese Microfinance Company,Ying Wang,한국아시아학회,2021
,31,POSRI 보고서 -Big Data로 들여다본 집단지성과 집단사고의 차이,김호인(수석연구원),포스코경영연구원,2016
,32,The Arrival of the Industry 4.0 and the Importance of Corporate Big Data Utilization,"AN, Haeri",East Asia Business Economics Association,2022
,33,Awareness and Resolution of Touristification in Korea Using Social Media Big Data Analytics,Yoonhee Cho,People&Global Business Association,2021
,34,A Systematic Review of Big Data: Research Approaches and Future Prospects,"Cobanoglu, Cihan",Smart Tourism Research Center,2022
,35,A Study on Efficient Building Energy Management System Based on Big Data,"Chang, Young-Hyun",The Institute of Internet,2019
,36,Enhancing Career Fit : A Big Data-driven “Job Matching” System,Ronald Sukwadi,한국경영정보학회,2024
,37,The Arrival of the Industry 4.0 and the Importance of Corporate Big Data Utilization,안해리,동아시아경상학회,2022
,38,Analysis of the Current and Future of the Artificial Intelligence in Financial Industry with Big Data Techniques,Eun Jung Go,사람과세계경영학회,2020
,39,[IB-1] Korean Smart Healthy City Platform Design: Integrating Big-Thick Data with Ethical Considerations,Inyong Jeong,한국정보통신학회,2024
,40,Text Mining and Visualization Using Big Data Based Press Meta Information,Soo-Tai Nam(남수태),한국정보통신학회,2024
,41,A Study on ANTI-TERROR System Using Big Data Based,Lee Jae young,J-INSTITUTE,2018
,42,스팀터빈 복수기 진공 개선을 위한 AI-Big Data 품질기법 적용 연구,허길영,한국품질경영학회,2021
,43,A Trend Analysis on E-sports using Social Big Data,여경아,한국스포츠과학회,2024
,44,A Study on Big Data-based GraphX Model for Social Network Service,조이상,한국지식정보기술학회,2020
,45,A Study on Efficient Building Energy Management System Based on Big Data,장영현,한국인터넷방송통신학회,2019
,46,Electric vehicle charging demand forecasting model based on big data technologies,"Arias, M.B.",Applied Science Publishers,2016
,47,Factors Affecting the Use of Big Data: Focusing on the UTAUT2,박광오,대한경영정보학회,2022
,48,Ecological predictions using AI in the era of big data to a dvance pest management,Hyoseok Lee,한국응용곤충학회,2024
,49,Development of the Unified Database Design Methodology for Big Data Applications = based on MongoDB,이준호(Junho Lee ),한국컴퓨터정보학회,2018
,50,A Design of DBaaS-Based Collaboration System for Big Data Processing,"Jung, Yean-Woo",The Institute of Internet,2016
,51,A Design of DBaaS-Based Collaboration System for Big Data Processing,정연우,한국인터넷방송통신학회,2016
,52,A Design of DBaaS-Based Collaboration System for Big Data Processing,Yean-Woo Jung,한국인터넷방송통신학회,2016
,53,"The 4th Industrial Revolution Era and Emergency Preparedness Policy: Artificial Intelligence, Big Data Analysis, Cloud Computing, Drone Use",Jae Eun Lee,위기관리 이론과 실천,2019
,54,Design and Implementation of a Dynamic Educational Content Viewer with Big Data Analytics Functionality,"Seong-Yeon Ju,Min-Ho Song,Ga-Ae Ryu,Mihye Kim,Kwan-Hee Yoo",보안공학연구지원센터,2014
,55,A Big Data Analysis System for Financial Trading,Shian Chang Huang,People&Global Business Association,2017
,56,A Big Data Outlier Detection System Using HDFS and RHive for Historical Data,Young-gi Kim,중소기업융합학회,2015
,57,Utilizing Integrated Public Big Data in the Database System for Analyzing Vehicle Accidents,Gun-woo Lee(이건우),한국컴퓨터정보학회,2017
,58,Analysis of the Status of Artificial Medical Intelligence Technology Based on Big Data,Kyung-A KIM,한국인공지능학회,2022
,59,"Knowledge Extractions, Visualizations, and Inference from the big Data in Healthcare and Medical",김진성,한국지능시스템학회,2013
,60,Big Data Analysis: Innovation of College English Writing Teaching: A Quantitative Research on “One Million Essays on Same Topics” English Writing Activity,Su Yao,아시아사회과학학회,2021
,61,Analysis of Social Media Utilization based on Big Data-Focusing on the Chinese Government Weibo,Xiang Li,한국인터넷정보학회,2022
,62,Big Data를 활용한 여성소비자의 특성연구,김은주,한국디지털정책학회,2015
,63,Urban Big Data: Social Costs Analysis for Urban Planning with Crowd-sourced Mobile Sensing Data,신동윤,한국BIM학회,2023
,64,Big Data and Visualization,김상기,대한교통학회,2016
,65,A Study of Development a Big Data-based CS Model for Maritime Traffic Assessment,이의종,한국항해항만학회,2024
,66,Big data analytics using optimized LSTM for carbon cost reduction in the construction industry,Yuhui Zhou,Techno-Press,2024
,67,"Big Data Analysis: Managerial Applications, Taxonomy, and Cases",최무진,한국로고스경영학회,2011
,68,Big Data Analysis of Weather Condition and Air Quality on Cosmetics Marketing,"Wang, Zebin",Korea Data Strategy Society,2017
,69,"Knowledge Extractions, Visualizations, and Inference from the big Data in Healthcare and Medical","Kim, Jin Sung",Korean Institute of Intelligent Systems,2013
,70,Examining the Impact of Weather Factors on Yield Industry Vitalization on Big Data Foundation Technique,Yun-Jeong Kang(강윤정),한국엔터테인먼트산업학회,2017
,71,Can Big Data Help Predict Financial Market Dynamics?: Evidence from the Korean Stock Market,표동진,대외경제정책연구원,2017
,72,An Analysis of IT Proposal Evaluation Results using Big Data-based Opinion Mining = 빅데이터 분석 기반의 오피니언 마이닝을 이용한 정보화 사업 평가 분석,Hong Sam Kim(김홍삼),한국산업경영시스템학회,2018
,73,Monte Carlo simulation-based traffic speed forecasting using historical big data,"Jeon, S.",North-Holland,2016
,74,Big Data Analysis of Weather Condition and Air Quality on Cosmetics Marketing,Zebin Wang,한국데이타베이스학회,2017
,75,Big Data-oriented Analysis on Issues of the Hyper-connected Society,Sungbum Park(박승범),국제e-비즈니스학회,2015
,76,Indonesia's Connectography Analysis Using Big Data,황승준,한국로고스경영학회,2023
,77,Analyzing Box-Office Hit Factors Using Big Data: Focusing on Korean Films for the Last 5 Years,"Hwang, Youngmee",The Korea Institute of Information and Commucation Engineering,2017
,78,A Competitive Analysis of Coffee Franchise Brands on Social Media Using Big Data,Hoanhsu Le,한국인터넷전자상거래학회,2015
,79,Examining the Impact of Weather Factors on Yield Industry Vitalization on Big Data Foundation Technique,강윤정,한국엔터테인먼트산업학회,2017
,80,Dynamic Data Migration in Hybrid Main Memories for In-Memory Big Data Storage,Hai Thanh Mai,한국전자통신연구원,2014
,81,Design and Implementation of Dynamic Recommendation Service in Big Data Environment,김룡,한국데이터전략학회,2019
,82,Development of a Platform Using Big Data-Based Artificial Intelligence to Predict New Demand of Shipbuilding,이상원,한국인터넷방송통신학회,2019
,83,"Advanced Technologies in Blockchain, Machine Learning, and Big Data",박지수,한국정보처리학회,2020
,84,Design and Implementation of Dynamic Recommendation Service in Big Data Environment,Kim Ryong,한국데이타베이스학회,2019
,85,Big data driven decision making and multi-prior models collaboration for media restoration,"Jiang, F.",Springer Science + Business Media,2016
,86,Big Data-oriented Analysis on Issues of the Hyper-connected Society,박승범,국제e-비즈니스학회,2015
,87,The Effect of Big Data-based Fashion Shopping Applications on App Users' Continuous Usage Intention,Hyekyung Hong,한국패션비즈니스학회,2018
,88,A renewable energies-assisted sustainable development plan for Iran using techno-econo-socio-environmental multivariate analysis and big data,"Ifaei, Pouya",Elsevier,2017
,89,"Knowledge Extractions, Visualizations, and Inference from the big Data in Healthcare and Medical",Jin Sung Kim(김진성),한국지능시스템학회,2013
,90,A Competitive Analysis of Coffee Franchise Brands on Social Media Using Big Data,레환수,한국인터넷전자상거래학회,2015
,91,A Study on Big Data-Based Analysis of Risk Factors for Depression in Adolescents,장춘옥,국제문화기술진흥원,2023
,92,Trajectory Privacy for Publishing Big Data,Rashid Tojiboev,한국EA학회,2019
,93,Mobility Big Data-Based Movement Patterns and Inducement Factors Analysis,배민철,대한국토·도시계획학회,2023
,94,A Big Data-Driven Business Data Analysis System : Applications of Artificial Intelligence Techniques in Problem Solving,Donggeun Kim,한국경영정보학회,2023
,95,Adopting Big Data AI and Robo-Advisor to Investment Strategy : Case of Vanguard,이병욱(ByungUk Lee),피터드러커 소사이어티,2024
,96,A basis of spatial big data analysis with map-matching system,"Cho, W.",Springer Science + Business Media,2017
,97,"A Public Perception Study on the new word ""Corona Blue"":Focusing on Social Media Big Data Analysis","Ann, Myung Suk",The International Promotion Agency of Culture Technology,2020
,98,A standards-based ontology and support for Big Data Analytics in the insurance industry,Dimitrios A. Koutsomitropoulos,한국통신학회,2017
,99,A Study on the Research Trends of Big Data at Public Libraries : with a Focus on the Journal “Public Library Quarterly”,이성신,건국대학교 GLOCAL(글로컬)캠퍼스 지식콘텐츠연구소,2022
,100,FROM BROWSING TO BUYING: HOW BIG DATA IS TRANSFORMING E-COMMERCE,Nuraeni,글로벌지식마케팅경영학회,2023
,1,Developing a Big Data Analytic Model and a Platform for Particulate Matter Prediction: A Case Study,Sung-Hyun Kim,한국지능시스템학회,2019
,2,Exchange of Data for Big Data in Hybrid Cloud Environment,Chi-gon Hwang,보안공학연구지원센터,2015
,3,Keyword Network Analysis through Big Data on Well-being of Young Children with Disabilities,Hyung Mee Kim(Hyung Mee Kim),The Pacific Early Childhood Education Research Association(환태평양유아교육연구학회),2024
,4,Network Anomaly Traffic Detection Using WGAN-CNN-BiLSTM in Big Data Cloud–Edge Collaborative Computing Environment,Yue Wang,한국정보처리학회,2024
,5,Di-ANFIS: an integrated blockchain–IoT–big data-enabled framework for evaluating service supply chain performance,Seyed Mojtaba Hosseini Bamakan,한국CDE학회,2021
,6,Effects of Calculation of Sexual Crime Prevention Index through Public Big Data Analysis on the Residential Choice in Seoul Autonomous Gu and Their Policy Implications,송민기,한국비교정부학회,2019
,7,"Relations Between Paprika Consumption and Unstructured Big Data, and Paprika Consumption Prediction",조용빈,한국콘텐츠학회,2019
,8,초고령사회에서의 건강과 돌봄을 위한 AI와 Big Data의 활용,Soo-Yong Shin,한국노년학회,2018
,9,Rearch of Late Adolcent Activity based on Using Big Data Analysis,Hye-Sun Lee,국제문화기술진흥원,2022
,10,Analyses of Question Types and Evidence Evaluation Types in Big Data Analysis for 7th Grade Students,유다연,한국교원대학교 뇌·AI기반교육연구소,2023
,11,Study of the optimal algorithm for production process based on big data to achieve smart factory in the textile industry,Wook Kim,한국산업경영시스템학회,2021
,12,A Study on the Survival Rate of Lip-Oral-Pharyngeal Cancer Using Big Data,장현선,대한구강악안면병리학회,2023
,13,"An Efficient Algorithm for Big Data Prediction of Pipelining, Concurrency (PCP) and Parallelism based on TSK Fuzzy Model = TSK 퍼지 모델 이용한 효율적인 빅 데이터 PCP 예측 알고리즘",김장영,The Korea Institute of Information and Commucation Engineering,2015
,14,U-Healthcare 기기에서 DRDoS공격 보안위협과 Big Data를 융합한 대응방안 연구,허윤아,한국융합학회,2015
,15,A Study on the Hotel Economic Trends Using Unstructured Big Data: Focusing on the Comparison of Pre-COVID-19 and COVID-19 Periods,이규태,한국비교정부학회,2023
,16,Leveraging Business Strategy Based on Customer Sentiment Embedded in Big Data of Social Media in Saudi Arabia,Young-Eun PARK,한국유통과학회,2023
,17,Leveraging Business Strategy Based on Customer Sentiment Embedded in Big Data of Social Media in Saudi Arabia,Young-Eun PARK,Korea Distribution Science Association,2023
,18,Analyzing trends in cultural contents tourism using big data,최윤희,한국인터넷방송통신학회,2023
,19,Predicting Selling Price of First Time Product for Online Seller using Big Data Analytics,"Deora, Sukhvinder Singh",International Journal of Computer ScienceNetwork Security,2021
,20,Integrated Center for Analytics (ICA): An Integrative Approach for Big Data Stakeholders,최무진,한국로고스경영학회,2018
,21,Insights Discovery through Hidden Sentiment in Big Data: Evidence from Saudi Arabia's Financial Sector,"PARK, Young-Eun",Korea Distribution Science Association,2020
,22,Export-Import Value Nowcasting Procedure Using Big Data-AIS and Machine Learning Techniques,Jimmy NICKELSON,한국유통과학회,2022
,23,Medical Internet of Things and Big Data in Healthcare,Dimiter V. Dimitrov,대한의료정보학회,2016
,24,Semantic Compatibility Condition in American English: A Big Data-based Trend Analysis of Ethnic Slurs,윤수원(Suwon Yoon),한국생성문법학회,2021
,25,Access efficiency of small sized files in Big Data using various Techniques on Hadoop Distributed File System platform,"Alange, Neeta",International Journal of Computer ScienceNetwork Security,2021
,26,Research on Tourist Satisfaction Evaluation with Northeast Asia Royal Palace  Based on Big Data,"Jing, Qiwei",한국비즈니스학회,2023
,27,Public Opinion on Lockdown (PSBB) Policy in Overcoming COVID-19 Pandemic in Indonesia: Analysis Based on Big Data Twitter,Catur Suratnoaji,충남대학교 아시아여론연구소,2020
,28,Application of a Mobile Chronic Disease Health-Care System for Hypertension Based on Big Data Platforms,"Li, Dingkun",Hindawi Limited,2018
,29,Analysis of Dental Language Network in News Articles Using News Big Data,문경희,대한예방치과학회,2020
,30,Export-Import Value Nowcasting Procedure Using Big Data-AIS and Machine Learning Techniques,"NICKELSON, Jimmy",Korea Distribution Science Association,2022
,31,Creating a better healthcare environment: Usage of Big data recommendations,Zaya Sukhbat,한국경영과학회,2018
,32,ONETOOL for the analysis of family-based big data,"Song, Yeunjoo E",Oxford University Press,2018
,33,A Study on Security Event Detection in ESM Using Big Data and Deep Learning,"Lee, Hye-Min",The Institute of Internet,2021
,34,Analysis of Landscape Characteristics of the Historical Culture Road Project - Based on Big Data Analysis of Insadong Road -,Geontae Kim,전북대학교 부설 휴양및경관계획연구소,2018
,35,A Study on Adaptive Smart Platform for Intelligent Software in Big Data Environment,김정식,한국지식정보기술학회,2020
,36,A Study on User Perception of Tourism Platform Using Big Data,전세원,한국인터넷방송통신학회,2024
,37,An Analysis on Crisis of Local Universities and Overcoming Measures: Focused on the Analysis of Convergence Education Trends Based on Social Big Data,이상엽,한국비교정부학회,2022
,38,PSS Evaluation Based on Vague Assessment Big Data: Hybrid Model of Multi-Weight Combination and Improved TOPSIS by Relative Entropy,Lianhui Li,한국정보처리학회,2024
,39,A Study on the Analysis of Solar Consumer Perception Using Big Data,이승원,국제문화기술진흥원,2024
,40,The Development of Big Data-based Accident Cause Classification System = 빅데이터 기반 사고원인 분류체계 고도화,Dae Ho Kim(김대호),대한인간공학회,2019
,41,Big Data의 이해- 가치와 도입전략,이성희(Lee Sung Hee),한국정보기술학회,2012
,42,A Novel Decision Model to Support the Prediction of Asthma Among the Big Data’s of Various Different Patient’s,Abhinav Hans,보안공학연구지원센터,2016
,43,Big Data-Driven Approach for Health Inequalities in Foreign Patients with Injuries Visiting Emergency Rooms,Jin Young Kang,대한의료정보학회,2020
,44,A Keyword Network Analysis of Standard Medical Terminology for Musculokeletal System Using Big Data,최병관,한국디지털정책학회,2022
,45,Big Data-Based Analysis of Characteristics of Consumption Sales by Region and Age : Focused on Seoul,"Lee, Su-Bin",대한국토·도시계획학회,2021
,46,The Development of a Real-Time Disease Prediction Model through Big Data-based Analysis of Crop-Pathogen-Environment Interactions,Seungbo Lee,한국콘텐츠학회,2024
,47,Managing Big Data in the Meetings and Events Industry: A Qualitative Study,김우혁,(사)한국관광레저학회,2019
,48,A Network Intrusion Security Detection Method Using BiLSTM-CNN in Big Data Environment,Hong Wang,한국정보처리학회,2023
,49,Spatial correlation and determinants of subjective residential environment evaluation by household types using big data: Focusing on the residents of apartments in Seoul,"Jang, Yoonjeung(장윤정)",한국지적정보학회,2021
,50,"검색, Big Data에서 BIG INSIGTH로 기업, 미래를 발견하다!",강용성,한국지능정보시스템학회,2012
,51,Solving the SW Industry Human Resource Paradox through Big Data: A Study on News Network Analysis,Juho Song,한국정보통신학회,2021
,52,A Group Key based Security Model for Big Data System,Heeyoul Kim,보안공학연구지원센터,2016
,53,IOT와 Big Data의 연계를 통한 범죄예방 활용방안,오세연(Sei-Youen Oh),한국콘텐츠학회,2015
,54,VTS BIG DATA를 활용한 해상교통관제항로 패턴 분석,이승희,한국항해항만학회,2014
,55,내비게이션 BIG DATA를 활용한 수시교통량 자료 AADT 추정 방안,박현석,한국ITS학회,2016
,56,A Method of Detecting Careless Email Use that May Cause Security Problems Based on Analysis of Enterprise Email Big Data,Sung-Min Kim,보안공학연구지원센터,2016
,57,Constructing Efficient Regional Hazardous Weather Prediction Models through Big Data Analysis,Jaedong Lee,한국지능시스템학회,2016
,58,Constructing Efficient Regional Hazardous Weather Prediction Models through Big Data Analysis,이재동,한국지능시스템학회,2016
,59,Research on Big Data-Based E-Learning Contents Authoring Services,Seung-Hwan Ju,보안공학연구지원센터,2016
